{
  "$schema": "https://json-schema.org/draft/2020-12/schema",
  "$id": "https://github.com/movieclaw/movieclaw-plugins/blob/main/index.schema.json",
  "title": "MovieClaw plugin catalog",
  "description": "Schema version 2 of the official plugin index. The app downloads index.json (and index.json.sig) from the catalog release, not from /releases/latest. Fields may be added within schema 2; readers ignore fields they do not know. A breaking change ships under a new file name.",
  "type": "object",
  "additionalProperties": false,
  "required": ["schema", "generated_at", "signed", "key_id", "repository", "plugins"],
  "properties": {
    "schema": { "const": 2 },
    "generated_at": { "$ref": "#/$defs/utc" },
    "signed": {
      "type": "boolean",
      "description": "True when index.json.sig (Ed25519 over these exact bytes, base64 plus a newline) is published next to this file."
    },
    "key_id": {
      "description": "Which baked-in public key signed this file. Null when unsigned. The index must not announce a new key.",
      "anyOf": [
        { "type": "null" },
        { "type": "string", "pattern": "^[A-Za-z0-9._-]{1,64}$" }
      ]
    },
    "repository": { "type": "string", "format": "uri" },
    "plugins": {
      "type": "array",
      "items": { "$ref": "#/$defs/plugin" }
    }
  },
  "allOf": [
    {
      "if": { "properties": { "signed": { "const": false } }, "required": ["signed"] },
      "then": { "properties": { "key_id": { "type": "null" } } }
    },
    {
      "if": { "properties": { "signed": { "const": true } }, "required": ["signed"] },
      "then": { "properties": { "key_id": { "type": "string", "minLength": 1 } } }
    }
  ],
  "$defs": {
    "utc": {
      "type": "string",
      "pattern": "^\\d{4}-\\d{2}-\\d{2}T\\d{2}:\\d{2}:\\d{2}Z$"
    },
    "version": {
      "type": "string",
      "pattern": "^\\d+\\.\\d+\\.\\d+(?:[-+][0-9A-Za-z.-]+)?$"
    },
    "asset": {
      "description": "A file the app fetches separately. It must match sha256 and size; the signed index is the trust anchor, so any mirror may serve it.",
      "type": "object",
      "additionalProperties": false,
      "required": ["url", "sha256", "size"],
      "properties": {
        "url": { "type": "string", "format": "uri" },
        "sha256": { "type": "string", "pattern": "^[a-f0-9]{64}$" },
        "size": { "type": "integer", "minimum": 0 }
      }
    },
    "plugin": {
      "type": "object",
      "additionalProperties": false,
      "required": [
        "id",
        "name",
        "summary",
        "description",
        "category",
        "author",
        "homepage",
        "repository",
        "license",
        "origin",
        "icon",
        "screenshots",
        "deprecated",
        "latest",
        "latest_stable",
        "versions"
      ],
      "properties": {
        "id": { "type": "string", "pattern": "^[a-z][a-z0-9-]{1,38}[a-z0-9]$" },
        "name": { "type": "string", "minLength": 1, "maxLength": 60, "description": "Title of the newest version." },
        "summary": { "type": "string", "minLength": 1, "maxLength": 60, "description": "One line for a card." },
        "description": { "type": "string", "maxLength": 500 },
        "category": {
          "enum": ["storage", "downloader", "messaging", "sites", "library", "tools"],
          "description": "store.json category, else inferred from the newest version's requires."
        },
        "author": {
          "type": "object",
          "additionalProperties": false,
          "required": ["name", "url"],
          "properties": {
            "name": { "type": "string", "minLength": 1 },
            "url": { "type": ["string", "null"], "format": "uri" }
          }
        },
        "homepage": { "type": "string", "format": "uri" },
        "repository": { "type": "string", "format": "uri", "description": "Source directory on main." },
        "license": { "type": "string", "minLength": 1 },
        "origin": { "const": "official" },
        "icon": {
          "anyOf": [{ "type": "null" }, { "$ref": "#/$defs/asset" }],
          "description": "Hosted on the catalog release, file name carries the content hash."
        },
        "screenshots": { "type": "array", "items": { "$ref": "#/$defs/asset" } },
        "deprecated": {
          "anyOf": [
            { "type": "null" },
            {
              "type": "object",
              "additionalProperties": false,
              "required": ["reason", "replaced_by"],
              "properties": {
                "reason": { "type": "string", "minLength": 1 },
                "replaced_by": {
                  "anyOf": [
                    { "type": "null" },
                    { "type": "string", "pattern": "^[a-z][a-z0-9-]{1,38}[a-z0-9]$" }
                  ]
                }
              }
            }
          ]
        },
        "latest": {
          "anyOf": [{ "type": "null" }, { "$ref": "#/$defs/version" }],
          "description": "Newest version that is not yanked, prereleases included."
        },
        "latest_stable": {
          "anyOf": [{ "type": "null" }, { "$ref": "#/$defs/version" }],
          "description": "Newest version that is neither yanked nor a prerelease."
        },
        "versions": {
          "type": "array",
          "minItems": 1,
          "description": "Newest first (semver precedence).",
          "items": { "$ref": "#/$defs/release" }
        }
      }
    },
    "permissions": {
      "type": "object",
      "additionalProperties": false,
      "required": ["operations", "paths", "network", "callbacks", "events"],
      "properties": {
        "operations": { "type": "array", "items": { "type": "string" } },
        "paths": {
          "type": "array",
          "items": {
            "type": "object",
            "additionalProperties": false,
            "required": ["path", "mode"],
            "properties": {
              "path": { "type": "string", "minLength": 1 },
              "mode": { "enum": ["read", "rw"] }
            }
          }
        },
        "network": { "type": "boolean" },
        "callbacks": { "type": "array", "items": { "type": "string" } },
        "events": { "type": "array", "items": { "type": "string" } }
      }
    },
    "release": {
      "description": "One published version, with what it declared at its tag.",
      "type": "object",
      "additionalProperties": false,
      "required": [
        "version",
        "prerelease",
        "released_at",
        "yanked",
        "notes",
        "changelog_url",
        "source_url",
        "readme",
        "runtime",
        "sdk",
        "requires",
        "platforms",
        "permissions",
        "web",
        "dependencies",
        "artifacts"
      ],
      "properties": {
        "version": { "$ref": "#/$defs/version" },
        "prerelease": { "type": "boolean" },
        "released_at": { "$ref": "#/$defs/utc" },
        "yanked": {
          "anyOf": [
            { "type": "null" },
            {
              "type": "object",
              "additionalProperties": false,
              "required": ["reason"],
              "properties": { "reason": { "type": "string", "minLength": 1 } }
            }
          ]
        },
        "notes": { "type": "string", "description": "Markdown: this version's CHANGELOG section." },
        "changelog_url": { "type": "string", "format": "uri" },
        "source_url": { "type": "string", "format": "uri" },
        "readme": { "anyOf": [{ "type": "null" }, { "$ref": "#/$defs/asset" }] },
        "runtime": { "enum": ["process", "inline", "exec"] },
        "sdk": { "type": "string", "pattern": "^\\^?\\d+\\.\\d+$" },
        "requires": {
          "type": "object",
          "additionalProperties": { "type": "string" },
          "description": "Contract name to ^major.minor. With sdk, this is what the server checks before install."
        },
        "platforms": { "type": "array", "minItems": 1, "items": { "type": "string", "minLength": 1 } },
        "permissions": { "$ref": "#/$defs/permissions" },
        "web": { "type": "boolean", "description": "The package carries web pages (approval asks separately)." },
        "dependencies": {
          "anyOf": [
            { "type": "null" },
            {
              "type": "object",
              "additionalProperties": false,
              "required": ["lock", "packages"],
              "properties": {
                "lock": {
                  "$ref": "#/$defs/asset",
                  "description": "requirements.lock at the tag. Its sha256 is the digest the server's approval asks for."
                },
                "packages": {
                  "type": "array",
                  "items": {
                    "type": "object",
                    "additionalProperties": false,
                    "required": ["name", "version", "native"],
                    "properties": {
                      "name": { "type": "string", "minLength": 1 },
                      "version": { "type": "string", "minLength": 1 },
                      "native": { "type": "boolean" }
                    }
                  }
                }
              }
            }
          ]
        },
        "artifacts": {
          "type": "array",
          "minItems": 1,
          "items": {
            "type": "object",
            "additionalProperties": false,
            "required": ["platform", "filename", "url", "sha256", "size"],
            "properties": {
              "platform": { "type": "string", "minLength": 1 },
              "filename": { "type": "string", "minLength": 1 },
              "url": { "type": "string", "format": "uri" },
              "sha256": { "type": "string", "pattern": "^[a-f0-9]{64}$" },
              "size": { "type": "integer", "minimum": 0 }
            }
          }
        }
      }
    }
  }
}
